{
  "$schema": "https://json-schema.org/draft/2020-12/schema",
  "type": "object",
  "properties": {
    "assetSetHash": {
      "type": "string",
      "pattern": "^sha256:[0-9a-f]{64}$"
    },
    "buildId": {
      "type": "string",
      "pattern": "^[A-Za-z0-9][A-Za-z0-9._:/-]{0,127}$"
    },
    "contractVersions": {
      "type": "object",
      "properties": {
        "assetSet": {
          "type": "number",
          "const": 2
        },
        "definition": {
          "type": "number",
          "const": 2
        },
        "delivery": {
          "type": "number",
          "const": 2
        },
        "progression": {
          "type": "number",
          "const": 1
        },
        "projection": {
          "type": "number",
          "const": 1
        },
        "renderBundle": {
          "type": "number",
          "const": 2
        },
        "runtime": {
          "type": "number",
          "const": 2
        }
      },
      "required": [
        "assetSet",
        "definition",
        "delivery",
        "progression",
        "projection",
        "renderBundle",
        "runtime"
      ],
      "additionalProperties": false
    },
    "definitionHash": {
      "type": "string",
      "pattern": "^sha256:[0-9a-f]{64}$"
    },
    "presentationId": {
      "type": "string",
      "pattern": "^[A-Za-z0-9][A-Za-z0-9._:/-]{0,127}$"
    },
    "publicationEpoch": {
      "type": "integer",
      "minimum": 1,
      "maximum": 9007199254740991
    },
    "publicationManifestHash": {
      "type": "string",
      "pattern": "^sha256:[0-9a-f]{64}$"
    },
    "renderBundleHash": {
      "type": "string",
      "pattern": "^sha256:[0-9a-f]{64}$"
    },
    "schemaVersion": {
      "type": "number",
      "const": 2
    },
    "sourceDraftRevision": {
      "type": "integer",
      "minimum": 0,
      "maximum": 9007199254740991
    }
  },
  "required": [
    "assetSetHash",
    "buildId",
    "contractVersions",
    "definitionHash",
    "presentationId",
    "publicationEpoch",
    "publicationManifestHash",
    "renderBundleHash",
    "schemaVersion",
    "sourceDraftRevision"
  ],
  "additionalProperties": false,
  "$id": "https://contracts.unframe.dev/presentation/published-presentation.v2.schema.json"
}
