{
  "schemaVersion": 2,
  "buildId": "build-1",
  "presentationId": "demo",
  "sourceDraftRevision": 1,
  "definitionHash": "sha256:86adc688b680f1a55dfc54bb3d04ef757dae7a7275c9079e6a5c8cb25f8e5763",
  "renderBundleHash": "sha256:68baf790c1c2e7f3b104966017be5392b27a10dcbb42b1148a611c286ab94d95",
  "assetSetHash": "sha256:204a4e2ca13609d961ffb7bbb69646c240286a4242bf0650e725890c78a9e7b8",
  "contractVersions": {
    "definition": 2,
    "renderBundle": 2,
    "assetSet": 2,
    "delivery": 2,
    "runtime": 2,
    "progression": 1,
    "projection": 1
  },
  "publicationEpoch": 1,
  "publicationManifestHash": "sha256:0e97a6d1ce69c96ea80726ae003caca00e45349726a03aa1e2d6ca0303c099c9"
}
